{
  "contract_version": "1.0.0",
  "generated_at": "2026-07-01T09:05:00+05:30",
  "source_universe_label": "Share within reported SIAM universe",
  "rows": [
    {
      "period_date": "2024-07-01",
      "period_type": "month",
      "fiscal_year": "FY25",
      "fiscal_quarter": "Q2FY25",
      "category": "2W",
      "segment": "Scooter",
      "sub_segment": null,
      "company_canonical": "Alpha Motors",
      "company_raw": "Alpha Motors",
      "flow": "domestic",
      "powertrain": "all",
      "geography": "IN",
      "metric": "units",
      "value": 39778.0,
      "unit": "units",
      "source": "SIAM",
      "source_file": "sample_fixture_v1",
      "source_period": "2024-07",
      "native_frequency": "month",
      "calc_status": "reported",
      "revision": 0,
      "ingest_date": "2026-07-01T09:00:00+05:30",
      "confidence": "high",
      "is_superseded": false,
      "is_partial": false,
      "periods_present": null,
      "periods_expected": null
    },
    {
      "period_date": "2024-07-01",
      "period_type": "month",
      "fiscal_year": "FY25",
      "fiscal_quarter": "Q2FY25",
      "category": "2W",
      "segment": "Motor cycles",
      "sub_segment": null,
      "company_canonical": "Beta Auto",
      "company_raw": "Beta Auto",
      "flow": "domestic",
      "powertrain": "all",
      "geography": "IN",
      "metric": "units",
      "value": 29778.0,
      "unit": "units",
      "source": "SIAM",
      "source_file": "sample_fixture_v1",
      "source_period": "2024-07",
      "native_frequency": "month",
      "calc_status": "reported",
      "revision": 0,
      "ingest_date": "2026-07-01T09:00:00+05:30",
      "confidence": "high",
      "is_superseded": false,
      "is_partial": false,
      "periods_present": null,
      "periods_expected": null
    },
    {
      "period_date": "2024-07-01",
      "period_type": "month",
      "fiscal_year": "FY25",
      "fiscal_quarter": "Q2FY25",
      "category": "2W",
      "segment": "Scooter",
      "sub_segment": null,
      "company_canonical": "Gamma Mobility",
      "company_raw": "Gamma Mobility",
      "flow": "domestic",
      "powertrain": "all",
      "geography": "IN",
      "metric": "units",
      "value": 17778.0,
      "unit": "units",
      "source": "SIAM",
      "source_file": "sample_fixture_v1",
      "source_period": "2024-07",
      "native_frequency": "month",
      "calc_status": "reported",
      "revision": 0,
      "ingest_date": "2026-07-01T09:00:00+05:30",
      "confidence": "high",
      "is_superseded": false,
      "is_partial": false,
      "periods_present": null,
      "periods_expected": null
    },
    {
      "period_date": "2024-07-01",
      "period_type": "month",
      "fiscal_year": "FY25",
      "fiscal_quarter": "Q2FY25",
      "category": "2W",
      "segment": "Scooter",
      "sub_segment": null,
      "company_canonical": "Delta Two Wheelers",
      "company_raw": "Delta Two Wheelers",
      "flow": "domestic",
      "powertrain": "all",
      "geography": "IN",
      "metric": "units",
      "value": 11778.0,
      "unit": "units",
      "source": "SIAM",
      "source_file": "sample_fixture_v1",
      "source_period": "2024-07",
      "native_frequency": "month",
      "calc_status": "reported",
      "revision": 0,
      "ingest_date": "2026-07-01T09:00:00+05:30",
      "confidence": "high",
      "is_superseded": false,
      "is_partial": false,
      "periods_present": null,
      "periods_expected": null
    },
    {
      "period_date": "2024-07-01",
      "period_type": "month",
      "fiscal_year": "FY25",
      "fiscal_quarter": "Q2FY25",
      "category": "2W",
      "segment": "Scooter",
      "sub_segment": null,
      "company_canonical": "Epsilon EV",
      "company_raw": "Epsilon EV",
      "flow": "domestic",
      "powertrain": "all",
      "geography": "IN",
      "metric": "units",
      "value": 0.0,
      "unit": "units",
      "source": "SIAM",
      "source_file": "sample_fixture_v1",
      "source_period": "2024-07",
      "native_frequency": "month",
      "calc_status": "reported",
      "revision": 0,
      "ingest_date": "2026-07-01T09:00:00+05:30",
      "confidence": "high",
      "is_superseded": false,
      "is_partial": false,
      "periods_present": null,
      "periods_expected": null
    },
    {
      "period_date": "2024-07-01",
      "period_type": "month",
      "fiscal_year": "FY25",
      "fiscal_quarter": "Q2FY25",
      "category": "2W",
      "segment": "Scooter",
      "sub_segment": null,
      "company_canonical": "Delta Two Wheelers",
      "company_raw": "Delta Two Wheelers",
      "flow": "domestic",
      "powertrain": "ev",
      "geography": "IN",
      "metric": "units",
      "value": 1278.0,
      "unit": "units",
      "source": "SIAM",
      "source_file": "sample_fixture_v1",
      "source_period": "2024-07",
      "native_frequency": "month",
      "calc_status": "reported",
      "revision": 0,
      "ingest_date": "2026-07-01T09:00:00+05:30",
      "confidence": "high",
      "is_superseded": false,
      "is_partial": false,
      "periods_present": null,
      "periods_expected": null
    },
    {
      "period_date": "2024-07-01",
      "period_type": "month",
      "fiscal_year": "FY25",
      "fiscal_quarter": "Q2FY25",
      "category": "2W",
      "segment": "Scooter",
      "sub_segment": null,
      "company_canonical": "Delta Two Wheelers",
      "company_raw": "Delta Two Wheelers",
      "flow": "domestic",
      "powertrain": "ice",
      "geography": "IN",
      "metric": "units",
      "value": 10500.0,
      "unit": "units",
      "source": "SIAM",
      "source_file": "sample_fixture_v1",
      "source_period": "2024-07",
      "native_frequency": "month",
      "calc_status": "derived",
      "revision": 0,
      "ingest_date": "2026-07-01T09:00:00+05:30",
      "confidence": "medium",
      "is_superseded": false,
      "is_partial": false,
      "periods_present": null,
      "periods_expected": null
    },
    {
      "period_date": "2024-08-01",
      "period_type": "month",
      "fiscal_year": "FY25",
      "fiscal_quarter": "Q2FY25",
      "category": "2W",
      "segment": "Scooter",
      "sub_segment": null,
      "company_canonical": "Alpha Motors",
      "company_raw": "Alpha Motors",
      "flow": "domestic",
      "powertrain": "all",
      "geography": "IN",
      "metric": "units",
      "value": 39995.0,
      "unit": "units",
      "source": "SIAM",
      "source_file": "sample_fixture_v1",
      "source_period": "2024-08",
      "native_frequency": "month",
      "calc_status": "reported",
      "revision": 0,
      "ingest_date": "2026-07-01T09:00:00+05:30",
      "confidence": "high",
      "is_superseded": false,
      "is_partial": false,
      "periods_present": null,
      "periods_expected": null
    },
    {
      "period_date": "2024-08-01",
      "period_type": "month",
      "fiscal_year": "FY25",
      "fiscal_quarter": "Q2FY25",
      "category": "2W",
      "segment": "Motor cycles",
      "sub_segment": null,
      "company_canonical": "Beta Auto",
      "company_raw": "Beta Auto",
      "flow": "domestic",
      "powertrain": "all",
      "geography": "IN",
      "metric": "units",
      "value": 29995.0,
      "unit": "units",
      "source": "SIAM",
      "source_file": "sample_fixture_v1",
      "source_period": "2024-08",
      "native_frequency": "month",
      "calc_status": "reported",
      "revision": 0,
      "ingest_date": "2026-07-01T09:00:00+05:30",
      "confidence": "high",
      "is_superseded": false,
      "is_partial": false,
      "periods_present": null,
      "periods_expected": null
    },
    {
      "period_date": "2024-08-01",
      "period_type": "month",
      "fiscal_year": "FY25",
      "fiscal_quarter": "Q2FY25",
      "category": "2W",
      "segment": "Scooter",
      "sub_segment": null,
      "company_canonical": "Gamma Mobility",
      "company_raw": "Gamma Mobility",
      "flow": "domestic",
      "powertrain": "all",
      "geography": "IN",
      "metric": "units",
      "value": 17995.0,
      "unit": "units",
      "source": "SIAM",
      "source_file": "sample_fixture_v1",
      "source_period": "2024-08",
      "native_frequency": "month",
      "calc_status": "reported",
      "revision": 0,
      "ingest_date": "2026-07-01T09:00:00+05:30",
      "confidence": "high",
      "is_superseded": false,
      "is_partial": false,
      "periods_present": null,
      "periods_expected": null
    },
    {
      "period_date": "2024-08-01",
      "period_type": "month",
      "fiscal_year": "FY25",
      "fiscal_quarter": "Q2FY25",
      "category": "2W",
      "segment": "Scooter",
      "sub_segment": null,
      "company_canonical": "Delta Two Wheelers",
      "company_raw": "Delta Two Wheelers",
      "flow": "domestic",
      "powertrain": "all",
      "geography": "IN",
      "metric": "units",
      "value": 11995.0,
      "unit": "units",
      "source": "SIAM",
      "source_file": "sample_fixture_v1",
      "source_period": "2024-08",
      "native_frequency": "month",
      "calc_status": "reported",
      "revision": 0,
      "ingest_date": "2026-07-01T09:00:00+05:30",
      "confidence": "high",
      "is_superseded": false,
      "is_partial": false,
      "periods_present": null,
      "periods_expected": null
    },
    {
      "period_date": "2024-08-01",
      "period_type": "month",
      "fiscal_year": "FY25",
      "fiscal_quarter": "Q2FY25",
      "category": "2W",
      "segment": "Scooter",
      "sub_segment": null,
      "company_canonical": "Epsilon EV",
      "company_raw": "Epsilon EV",
      "flow": "domestic",
      "powertrain": "all",
      "geography": "IN",
      "metric": "units",
      "value": 0.0,
      "unit": "units",
      "source": "SIAM",
      "source_file": "sample_fixture_v1",
      "source_period": "2024-08",
      "native_frequency": "month",